diagnosis,count,percentage,global,irrelevant,local
sinus rhythm with multifocal pvcs with pacs,10,0.0,1,0,1
abnormal p waves,10,0.0,0,0,1
sinus bradycardia with frequent pvcs with 1st degree a-v block,10,0.0,1,0,1
inferior st-t changes may be a normal variant for a male of this age,10,0.0,0,0,1
lead(s) unsuitable for analysis: i ii iii avr avl avf v1 v2 v4 v5 v6,10,0.0,0,1,0
sinus rhythm with multifocal pvcs with pacs.,10,0.0,1,0,1
atrial fibrillation with uncontrolled ventricular response with pvcs or aberrant ventricular conduction,10,0.0,1,0,1
probable atrial fibrillation with slow ventricular response with pvc(s) or aberrant ventricular conduction.,10,0.0,1,0,1
sinus arrhythmia with multifocal pvcs with 1st degree a-v block.,9,0.0,1,0,1
inferior and septal st elevation - cannot rule out myocardial injury,9,0.0,1,0,1
"anteroseptal st elevation, consider recent infarction",9,0.0,1,0,1
changes in v2 are probably related to poor r wave progression but septal infarction cannot be excluded,9,0.0,1,0,1
consider acute infarction,9,0.0,1,0,0
atrial fibrillation with non-sustained ventricular tachycardia.,9,0.0,1,0,0
atrial fibrillation with slow ventricular response with multifocal pvcs or aberrant ventricular conduction.,9,0.0,1,0,1
inferior+ant/septal t wave change are nonspecific,9,0.0,0,0,1
sinus rhythm with frequent pacs with borderline 1st degree a-v block,9,0.0,1,0,1
sinus tachycardia with frequent pvcs with borderline 1st degree a-v block,9,0.0,1,0,1
atrial fibrillation with slow ventricular response with paroxysmal idioventricular rhythm or aberrant ventricular conduction.,9,0.0,1,0,1
possible ectopic atrial rhythm with pvcs with pacs,9,0.0,1,0,1
sinus tachycardia with sinus arrhythmia with pacs.,9,0.0,1,0,1
- 3:1 a-v block,9,0.0,1,0,0
sinus rhythm with occasional pacs with borderline 1st degree a-v block,9,0.0,1,0,1
possible ectopic atrial bradycardia with interpolated pvc(s),9,0.0,1,0,1
sinus arrhythmia with frequent pvcs with 1st degree a-v block.,9,0.0,1,0,1
bigeminal pacs,9,0.0,1,0,1
anterolateral t wave changes suggest myocardial injury/ischemia,9,0.0,1,0,1
ant/septal+lateral st changes are nonspecific,9,0.0,0,0,1
sinus bradycardia with sinus arrhythmia with pacs with 1st degree a-v block.,9,0.0,1,0,1
sinus rhythm with multifocal interpolated pvcs.,9,0.0,1,0,1
lead(s) unsuitable for analysis: i ii iii avr avl v1,9,0.0,0,1,0
extensive st-t changes may be due to myocardial infarction or cva,9,0.0,1,0,1
sinus bradycardia with sinus arrhythmia with pacs.,9,0.0,1,0,1
atrial flutter with 2:1 a-v block,9,0.0,1,0,0
possible extensive infarct with acute inferior changes,9,0.0,1,0,1
lead(s) unsuitable for analysis: avr v6,9,0.0,0,1,0
q equivalent in lateral leads,9,0.0,0,0,1
inferior/lateral t changes may be normal for age,9,0.0,0,0,1
inferior/lateral t changes are abnormal,9,0.0,0,0,1
lead(s) unsuitable for analysis: v3 v6,9,0.0,0,1,0
septal t wave changes are abnormal,9,0.0,0,0,1
lateral st-t changes are abnormal for age/sex,9,0.0,0,0,1
- demand atrial pacing and ineffective stimuli,9,0.0,1,0,1
sinus bradycardia with interpolated pvcs with borderline 1st degree a-v block,9,0.0,1,0,1
probable atrial fibrillation with uncontrolled ventricular response with pvcs.,9,0.0,1,0,1
lead(s) unsuitable for analysis: ii avr,9,0.0,0,1,0
sinus tachycardia with multifocal pvcs with pac(s).,9,0.0,1,0,1
intermittent conduction defect,9,0.0,1,0,0
lead(s) unsuitable for analysis: i ii iii avl avf,9,0.0,0,1,0
possible acute inferior infarction,9,0.0,1,0,0
inferior/lateral st-t changes are abnormal for age/sex,9,0.0,1,0,1
atrial fibrillation with uncontrolled ventricular response with non-sustained ventricular tachycardia,9,0.0,1,0,0
lead(s) unsuitable for analysis: v3 v4 v5 v6,9,0.0,0,1,0
sinus bradycardia with aberrantly conducted supraventricular complexes with 1st degree a-v block,9,0.0,1,0,1
consider acute anterolateral infarction,9,0.0,1,0,0
irregular ectopic atrial rhythm with pvcs.,9,0.0,1,0,1
- demand a-v sequential implanted pacemaker activity,9,0.0,1,0,1
possible ectopic atrial rhythm with multifocal pvcs.,9,0.0,1,0,1
abnormally high r:s ratio in v1,9,0.0,0,0,1
atrial flutter with pvcs or aberrant ventricular conduction.,8,0.0,1,0,1
sinus rhythm with frequent multifocal pvcs with pac(s).,8,0.0,1,0,1
atrial fibrillation with rapid ventricular response with paroxysmal idioventricular rhythm,8,0.0,1,0,0
extensive st-t changes are probably due to cardiac surgery,8,0.0,0,0,1
recent lateral infarct,8,0.0,1,0,0
"nonspecific st depression, anterolateral lds",8,0.0,0,0,1
changes are abnormal for age and sex. interpret together with clinical data,8,0.0,0,1,0
lead(s) avf were not used for morphology analysis,8,0.0,0,1,0
ant/septal+lateral st-t changes suggest myocardial infarction,8,0.0,1,0,1
atrial flutter with rapid ventricular response with frequent multifocal pvcs or aberrant ventricular conduction,8,0.0,1,0,1
possible atrial flutter with rapid ventricular response with multifocal pvcs or aberrant ventricular conduction,8,0.0,1,0,1
atrial flutter with bigeminal pvcs or aberrant ventricular conduction.,8,0.0,1,0,1
q waves in anterior leads,8,0.0,0,0,1
inferior and ant/septal st-t changes are abnormal,8,0.0,1,0,1
q in inferior + septal leads,8,0.0,0,0,1
lead(s) unsuitable for analysis: iii avl v1 v3,8,0.0,0,1,0
probable atrial fibrillation with rapid ventricular response with non-sustained ventricular tachycardia,8,0.0,1,0,0
sinus rhythm with occasional pacs with 1st degree a-v block.,8,0.0,1,0,1
sinus rhythm with interpolated pvcs with borderline 1st degree a-v block,8,0.0,1,0,1
old lateral infarction,8,0.0,1,0,0
inferior/lateral st-t changes suggest myocardial ischemia,8,0.0,1,0,1
inferior st-t changes are borderline,8,0.0,1,0,1
probable atrial fibrillation with fusion complexes or aberrant ventricular conduction,8,0.0,1,0,1
possible atrial flutter with slow ventricular response with pvc(s),8,0.0,1,0,1
possible ectopic atrial tachycardia with pvc(s).,8,0.0,1,0,1
sinus tachycardia with sinus arrhythmia with pvc(s) with borderline 1st degree a-v block,8,0.0,1,0,1
sinus rhythm with frequent pvcs with pacs,8,0.0,1,0,1
extensive t wave changes suggest myocardial infarction,8,0.0,1,0,1
possible ectopic atrial bradycardia with pvc(s) with pac(s),8,0.0,1,0,1
possible atrial flutter with rapid ventricular response with non-sustained ventricular tachycardia.,8,0.0,1,0,0
sinus rhythm with aberrantly conducted supraventricular complexes with pvc(s) with borderline 1st degree a-v block,8,0.0,1,0,1
atrial fibrillation with uncontrolled ventricular response with pvcs,8,0.0,1,0,1
"inferior and anterior st elevation, consider acute infarct",8,0.0,1,0,1
probable accelerated junctional rhythm with pvc(s).,8,0.0,1,0,1
possible atrial flutter with frequent pvcs or aberrant ventricular conduction.,8,0.0,1,0,1
possible ectopic atrial rhythm with frequent pacs,8,0.0,1,0,1
p wave abnormalities as above,8,0.0,0,0,1
possible ectopic atrial rhythm with interpolated pvcs,8,0.0,1,0,1
sinus bradycardia with multifocal pvcs with 1st degree a-v block,8,0.0,1,0,1
summary: technical error,8,0.0,0,1,0
possible ectopic atrial bradycardia with pvc(s).,8,0.0,1,0,1
atrial fibrillation with rapid ventricular response with paroxysmal idioventricular rhythm.,8,0.0,1,0,0
sinus bradycardia with sinus arrhythmia with multifocal pvcs,8,0.0,1,0,1
sinus tachycardia with frequent pvcs with pac(s).,8,0.0,1,0,1
"borderline t abnormalities, anterior leads",8,0.0,1,0,1
sinus tachycardia with sinus arrhythmia with pac(s),8,0.0,1,0,1
probable atrial fibrillation with slow ventricular response with pvcs,8,0.0,1,0,1
anterior st elevation,8,0.0,0,0,1
"sequence error: v2,v3 therefore omitted",8,0.0,0,1,0
borderline st elevation,8,0.0,1,0,1
sinus bradycardia with sinus arrhythmia with interpolated pvcs,8,0.0,1,0,1
broad r wave in i,8,0.0,0,0,1
frequent multiform premature ventricular contractions,8,0.0,1,0,1
sinus rhythm with aberrantly conducted supraventricular complexes with frequent multifocal pvcs.,8,0.0,1,0,1
rvh with repolarization abnormality,8,0.0,1,0,1
sinus rhythm with 2nd degree (mobitz ii) sa block with 1st degree a-v block.,8,0.0,1,0,0
acute anteroseptal infarct,8,0.0,1,0,0
baseline wander in lead(s) v2,8,0.0,0,1,0
baseline wander in lead(s) v6,8,0.0,0,1,0
- complete a-v block,8,0.0,1,0,0
lead(s) unsuitable for analysis: i ii iii avr avl v2,8,0.0,0,1,0
lead(s) unsuitable for analysis: ii iii avl avf,8,0.0,0,1,0
sinus rhythm with interpolated pvc(s) with pac(s),8,0.0,1,0,1
sinus rhythm with aberrantly conducted supraventricular complexes with pvcs with pacs,8,0.0,1,0,1
atrial-ventricular dual-paced rhythm,8,0.0,1,0,1
partial missing lead(s): v2,8,0.0,0,1,0
lead(s) unsuitable for analysis: i ii iii avr avl avf v1 v3 v4 v5 v6,8,0.0,0,1,0
lateral st-t changes suggest myocardial ischemia,8,0.0,1,0,1
interpolated premature ventricular contractions,8,0.0,1,0,1
*** extensive infarct *** with possible acute inferior and lateral changes,8,0.0,1,0,1
sinus bradycardia with interpolated pvc(s) with 1st degree a-v block.,8,0.0,1,0,1
non-sustained ventricular tachycardia,8,0.0,1,0,0
atrial flutter with slow ventricular response with pvc(s) or aberrant ventricular conduction,8,0.0,1,0,1
missing lead(s): v4,8,0.0,0,1,0
atrial fibrillation with slow ventricular response with frequent pvcs.,8,0.0,1,0,1
all 12 leads are missing,7,0.0,0,1,0
probable atrial fibrillation with multifocal pvcs.,7,0.0,1,0,1
sinus bradycardia with frequent multifocal pvcs with 1st degree a-v block,7,0.0,1,0,1
borderline t wave abnormalities,7,0.0,1,0,1
lead(s) unsuitable for analysis: i ii iii avr avl,7,0.0,0,1,0
lead(s) unsuitable for analysis: i ii iii avr avl avf v2 v3 v4 v5 v6,7,0.0,0,1,0
lead(s) unsuitable for analysis: v2 v4,7,0.0,0,1,0
lead(s) unsuitable for analysis: iii avl v1 v2 v3,7,0.0,0,1,0
lead(s) unsuitable for analysis: ii iii avr avl avf,7,0.0,0,1,0
consider posterior infarct,7,0.0,1,0,0
probable accelerated junctional rhythm with pvc(s),7,0.0,1,0,1
sinus tachycardia with aberrantly conducted supraventricular complexes with pvc(s).,7,0.0,1,0,1
sinus tachycardia with aberrantly conducted supraventricular complexes with pvcs with pacs.,7,0.0,1,0,1
atrial flutter with frequent multifocal pvcs or aberrant ventricular conduction,7,0.0,1,0,1
lead(s) unsuitable for analysis: v3 v5,7,0.0,0,1,0
lead(s) unsuitable for analysis: i avr,7,0.0,0,1,0
possible atrial flutter with rapid ventricular response with multifocal pvcs or aberrant ventricular conduction.,7,0.0,1,0,1
irregular ectopic atrial rhythm with frequent multifocal pvcs,7,0.0,1,0,1
sinus arrhythmia with frequent multifocal pvcs with 1st degree a-v block,7,0.0,1,0,1
consider anterior infarction though changes may be due to lvh,7,0.0,1,0,1
sinus rhythm with frequent multifocal pvcs with pacs,7,0.0,1,0,1
sinus rhythm with multifocal pvcs with pac(s) with borderline 1st degree a-v block,7,0.0,1,0,1
frequent multifocal premature ventricular contractions,7,0.0,1,0,1
lead(s) unsuitable for analysis: v1 v2 v3 v4 v5 v6,7,0.0,0,1,0
borderline short pr interval,7,0.0,1,0,1
"suggests arm lead reversal - only leads avf, v1 - v6 analysed",7,0.0,0,1,0
anteroseptal st elevation - probable post operative pericarditis,7,0.0,1,0,1
possible ectopic atrial rhythm with interpolated pvc(s).,7,0.0,1,0,1
av sequential pacing.,7,0.0,1,0,1
atrial fibrillation with slow ventricular response with paroxysmal idioventricular rhythm.,7,0.0,1,0,0
sinus rhythm with 2nd degree (mobitz ii) sa block with 1st degree a-v block,7,0.0,1,0,0
possible acute anterior infarction,7,0.0,1,0,0
sinus tachycardia with intermittent conduction defect.,7,0.0,1,0,0
atrial flutter with slow ventricular response with pvc(s),7,0.0,1,0,1
"probable anterior infarct, acute",7,0.0,1,0,0
sinus bradycardia with sinus arrhythmia with pvc(s) with borderline 1st degree a-v block.,7,0.0,1,0,1
sinus bradycardia with occasional pacs.,7,0.0,1,0,1
sinus bradycardia with aberrantly conducted supraventricular complexes with 1st degree a-v block.,7,0.0,1,0,1
possible atrial flutter with rapid ventricular response with frequent pvcs or aberrant ventricular conduction.,7,0.0,1,0,1
sinus tachycardia with pvc(s) with pac(s) with borderline 1st degree a-v block.,7,0.0,1,0,1
sinus rhythm with pvcs with occasional pacs.,7,0.0,1,0,1
inferior+ant/septal st-t changes are nonspecific,7,0.0,0,0,1
sinus bradycardia with sinus arrhythmia with multifocal pvcs.,7,0.0,1,0,1
paroxysmal idioventricular rhythm,7,0.0,1,0,0
possible ectopic atrial tachycardia with pvcs with pacs.,7,0.0,1,0,1
sinus bradycardia with multifocal interpolated pvcs,7,0.0,1,0,1
consider septal infarct though changes in v2 may be due to lvh,7,0.0,1,0,1
bigeminal pvcs,7,0.0,1,0,1
septal+lateral st changes are nonspecific,7,0.0,0,0,1
sinus tachycardia with sinus arrhythmia with non-sustained ventricular tachycardia.,7,0.0,1,0,1
probable sinus tachycardia.consider flutter and/or 2:1 a-v block,7,0.0,1,0,0
sinus arrhythmia with aberrantly conducted supraventricular complexes with pvcs.,7,0.0,1,0,1
atrial fibrillation with slow ventricular response with frequent pvcs,7,0.0,1,0,1
sinus arrhythmia with multifocal pvcs with borderline 1st degree a-v block,7,0.0,1,0,1
atrial flutter with frequent pvcs or aberrant ventricular conduction,7,0.0,1,0,1
lead(s) unsuitable for analysis: i ii iii avr avl avf v5 v6,7,0.0,0,1,0
probable sinus tachycardia. ? atrial tachycardia or flutter + 2:1 a-v block,7,0.0,1,0,0
sinus tachycardia with pvcs with pacs with borderline 1st degree a-v block,7,0.0,1,0,1
sinus arrhythmia with frequent multifocal pvcs with borderline 1st degree a-v block,7,0.0,1,0,1
inferior and septal t wave changes are borderline abnormal,7,0.0,1,0,1
lateral q+low r in anterior leads,7,0.0,0,0,1
3:1 a-v block,7,0.0,1,0,0
possible atrial flutter with interpolated pvc(s),7,0.0,1,0,1
baseline wander in lead(s) v4,7,0.0,0,1,0
inferior and septal t wave changes may be due to myocardial ischemia,7,0.0,1,0,1
probable recent anteroseptal infarct,7,0.0,1,0,0
lateral st-t changes are borderline abnormal for age/sex,7,0.0,1,0,1
repeat ecg to exclude technical error,7,0.0,0,1,0
possible ectopic atrial tachycardia with pvc(s) with pac(s),7,0.0,1,0,1
missing lead(s): v1,7,0.0,0,1,0
4:1 a-v block,7,0.0,1,0,0
anterolateral st changes may be due to hypertrophy and/or ischemia,7,0.0,1,0,1
"anterolateral q waves, probably due to lvh",7,0.0,1,0,1
sinus bradycardia with aberrantly conducted supraventricular complexes with interpolated pvc(s),6,0.0,1,0,1
- demand a-v sequential pacing and ineffective stimuli,6,0.0,1,0,1
probable old lateral infarction,6,0.0,1,0,0
sinus tachycardia with pvcs with pacs with borderline 1st degree a-v block.,6,0.0,1,0,1
sinus rhythm with aberrantly conducted supraventricular complexes with pvc(s) with pac(s).,6,0.0,1,0,1
probable atrial fibrillation with frequent multifocal pvcs,6,0.0,1,0,1
sinus rhythm with aberrantly conducted supraventricular complexes with pac(s).,6,0.0,1,0,1
sinus arrhythmia with frequent pvcs with 1st degree a-v block,6,0.0,1,0,1
lead(s) unsuitable for analysis: i v5,6,0.0,0,1,0
probably reciprocal to inferior infarct,6,0.0,1,0,0
probable old anterior infarction,6,0.0,1,0,0
probable extensive infarct with acute anterolateral changes,6,0.0,1,0,1
"minimal st elevation, diffuse leads",6,0.0,0,0,1
"abnormal t, probable ischemia, inferior leads",6,0.0,1,0,1
probable septal infarction - age undetermined,6,0.0,1,0,0
possible anterolateral infarction - age undetermined,6,0.0,1,0,0
inferior/lateral t changes may be a normal variant for a female of this age,6,0.0,0,0,1
ant/septal and lateral st-t changes are borderline,6,0.0,1,0,1
extensive t wave changes are borderline abnormal for age/sex,6,0.0,1,0,1
borderline prolonged qt interval,6,0.0,0,0,1
"inferior + anterior st elevation, consider recent infarction",6,0.0,1,0,1
atrial flutter with multifocal pvcs or aberrant ventricular conduction.,6,0.0,1,0,1
possible atrial flutter with bigeminal pvcs or aberrant ventricular conduction,6,0.0,1,0,1
atrial fibrillation with slow ventricular response with frequent multifocal pvcs.,6,0.0,1,0,1
inferior/lateral st-t changes are borderline abnormal for age/sex,6,0.0,1,0,1
lead(s) unsuitable for analysis: v2 v3 v4 v5 v6,6,0.0,0,1,0
anterior st changes may be due to myocardial ischemia,6,0.0,1,0,1
multiform premature ventricular contractions,6,0.0,1,0,1
lead(s) unsuitable for analysis: i ii iii avr avl avf v4 v5 v6,6,0.0,0,1,0
ant/septal+lateral t wave changes suggest myocardial infarction,6,0.0,1,0,1
frequent multifocal pvcs or aberrant ventricular conduction,6,0.0,1,0,1
possible atrial flutter with frequent multifocal pvcs or aberrant ventricular conduction.,6,0.0,1,0,1
sinus tachycardia with multifocal pvcs with pacs,6,0.0,1,0,1
sinus bradycardia with sinus arrhythmia with pvcs with borderline 1st degree a-v block,6,0.0,1,0,1
probable atrial fibrillation with frequent multifocal pvcs.,6,0.0,1,0,1
inferior + anterior st elevation - repeat if myocardial injury is suspected,6,0.0,1,0,1
probable atrial fibrillation with uncontrolled ventricular response with pvc(s).,6,0.0,1,0,1
lead(s) unsuitable for analysis: v2 v5,6,0.0,0,1,0
no further analysis attempted due to paced rhythm,6,0.0,1,0,0
irregular ectopic atrial bradycardia with pvc(s),6,0.0,1,0,1
septal and lateral st changes are nonspecific,6,0.0,0,0,1
sinus arrhythmia with frequent pvcs with borderline 1st degree a-v block,6,0.0,1,0,1
probable atrial fibrillation with uncontrolled ventricular response with pvc(s) or aberrant ventricular conduction,6,0.0,1,0,1
probable atrial fibrillation with rapid ventricular response with frequent pvcs.,6,0.0,1,0,1
sinus rhythm with aberrantly conducted supraventricular complexes with interpolated pvc(s).,6,0.0,1,0,1
probable atrial fibrillation with slow ventricular response with pvcs or aberrant ventricular conduction.,6,0.0,1,0,1
atrial flutter with 2:1 a-v block.,6,0.0,1,0,0
sinus tachycardia with frequent pvcs with pacs,6,0.0,1,0,1
sinus rhythm with occasional pacs with borderline 1st degree a-v block.,6,0.0,1,0,1
inferior t wave changes suggest myocardial infarct,6,0.0,1,0,1
sinus arrhythmia with frequent pvcs with borderline 1st degree a-v block.,6,0.0,1,0,1
ant/septal and lateral t wave changes are borderline abnormal,6,0.0,1,0,1
sinus tachycardia with sinus arrhythmia with 2nd degree (mobitz ii) sa block.,6,0.0,1,0,0
sinus rhythm with interpolated pvc(s) with borderline 1st degree a-v block.,6,0.0,1,0,1
possible acute extensive infarct,6,0.0,1,0,0
sinus rhythm with occasional pacs with 1st degree a-v block,6,0.0,1,0,1
sinus tachycardia with frequent multifocal pvcs with pac(s).,6,0.0,1,0,1
lead(s) unsuitable for analysis: iii avl v2,6,0.0,0,1,0
lead(s) unsuitable for analysis: iii avl v1 v2 v3 v4 v5 v6,6,0.0,0,1,0
sinus rhythm with paroxysmal idioventricular rhythm with 1st degree a-v block,6,0.0,1,0,0
sinus rhythm with interpolated pvc(s) with 1st degree a-v block.,6,0.0,1,0,1
inferior/lateral st-t changes,6,0.0,0,0,1
probable extensive infarct with acute lateral changes,6,0.0,1,0,1
lateral t wave changes may be due to myocardial infarct or cva,6,0.0,1,0,1
acute lateral infarct,6,0.0,1,0,0
extensive st changes may be due to hypertrophy and/or ischemia,6,0.0,1,0,1
faulty v4 - omitted from analysis,6,0.0,0,1,0
probable precordial electrode reversal,6,0.0,0,1,0
ant/septal and lateral st-t changes are abnormal,6,0.0,0,0,1
sinus bradycardia with frequent pvcs with 1st degree a-v block.,6,0.0,1,0,1
atrial flutter with rapid ventricular response with frequent pvcs or aberrant ventricular conduction,6,0.0,1,0,1
possible bvh with st-t changes,6,0.0,1,0,1
probable atrial fibrillation with slow ventricular response with pvc(s).,6,0.0,1,0,1
multi interpolated vent premature complexes,6,0.0,1,0,1
"a-v dual-paced complexes, a-noncapt due to af",6,0.0,1,0,1
acute anterolateral infarct,6,0.0,1,0,0
missing lead(s): v3,6,0.0,0,1,0
undetermined rhythm with fusion complexes,6,0.0,1,0,1
marked ant/septal stj depression,6,0.0,0,0,1
septal and lateral t wave changes may be due to myocardial ischemia,6,0.0,1,0,1
"nonspecific repol abnrm, anterolateral leads",6,0.0,0,0,1
atrial flutter with rapid ventricular response with non-sustained ventricular tachycardia,6,0.0,1,0,0
lateral t wave changes may be related to electronic pacemaker,6,0.0,0,0,1
- multiform interpolated pvcs,5,0.0,1,0,1
changes are probably due to lvh but consider septal infarct,5,0.0,1,0,1
anteroseptal st-t changes may be due to myocardial infarct or cva,5,0.0,1,0,1
inferior and lateral st elevation - probable lateral extension of infarct,5,0.0,1,0,1
septal and lateral st-t changes,5,0.0,0,0,1
lateral infarction - possibly acute,5,0.0,1,0,0
st changes in the inferior leads,5,0.0,0,0,1
probable left ventricular hypertrophy with st-t changes likely to be due in part to myocardial ischemia,5,0.0,1,0,1
sinus bradycardia. consider 2:1 sino-atrial block.,5,0.0,1,0,0
no further analysis made - doubt as to suitable beat(s). dominant group printed.,5,0.0,0,1,0
changes v2-v4 are probably related to poor r wave progression but anteroseptal infarction cannot be excluded,5,0.0,1,0,1
lateral st elevation may be a normal variant for age,5,0.0,0,0,1
ant/septal+lateral t wave changes are nonspecific,5,0.0,0,0,1
sinus bradycardia with frequent pvcs with borderline 1st degree a-v block.,5,0.0,1,0,1
strongly suggests pericarditis,5,0.0,1,0,0
ant/septal and lateral st changes may be due to myocardial ischemia,5,0.0,1,0,1
- demand ventricular pacing and ineffective stimuli,5,0.0,1,0,1
possible ectopic atrial rhythm with pvcs with pacs.,5,0.0,1,0,1
sinus tachycardia with sinus arrhythmia with non-sustained ventricular tachycardia,5,0.0,1,0,0
abnormal q suggests inferior infarct,5,0.0,1,0,1
qrs changes probably due to lvh but consider anteroseptal infarct,5,0.0,1,0,1
sinus rhythm with multifocal pvcs with pac(s) with 1st degree a-v block,5,0.0,1,0,1
short qtc : possible hypercalcemia,5,0.0,1,0,1
inferior/lateral st changes may be normal for age,5,0.0,0,0,1
septal t wave changes are borderline abnormal for age/sex,5,0.0,1,0,1
sinus rhythm with frequent pacs with borderline 1st degree a-v block.,5,0.0,1,0,1
baseline wander in lead(s) v1,5,0.0,0,1,0
st junctional depression are nonspecific,5,0.0,0,0,1
sinus bradycardia with sinus arrhythmia with 2nd degree (mobitz ii) sa block.,5,0.0,1,0,0
inferior t wave changes are possibly secondary to hypertension,5,0.0,1,0,1
lead(s) unsuitable for analysis: i ii iii avl avf v5 v6,5,0.0,0,1,0
lead(s) unsuitable for analysis: i v3 v4,5,0.0,0,1,0
sinus bradycardia with sinus arrhythmia with pvcs with 1st degree a-v block.,5,0.0,1,0,1
lateral t wave changes are borderline abnormal for age/sex,5,0.0,1,0,1
anteroseptal infarction - possibly acute,5,0.0,1,0,0
*** extensive infarct *** with possible acute inferior and anteroseptal changes,5,0.0,1,0,1
sinus bradycardia with occasional pacs,5,0.0,1,0,1
sinus tachycardia with aberrantly conducted supraventricular complexes with pvcs.,5,0.0,1,0,1
sinus bradycardia with frequent multifocal pvcs.,5,0.0,1,0,1
ant/septal+lateral st-t changes,5,0.0,0,0,1
possible ectopic atrial bradycardia with aberrantly conducted supraventricular complexes,5,0.0,1,0,1
these changes are unusual for a male of this age but could be a normal variant,5,0.0,1,0,0
missing lead(s): v2,5,0.0,0,1,0
lateral t wave changes are consistent with myocardial ischemia,5,0.0,1,0,1
baseline wander in lead(s) v3,5,0.0,0,1,0
inferior t wave changes may be related to electronic pacemaker,5,0.0,1,0,1
probable extensive infarction - age undetermined,5,0.0,1,0,0
? faulty v2 - omitted from analysis,5,0.0,0,1,0
lead(s) unsuitable for analysis: v5.,5,0.0,0,1,0
lead(s) unsuitable for analysis: ii v6,5,0.0,0,1,0
inferior + ant/septal t wave change,5,0.0,0,0,1
low r + q in anterolateral leads,5,0.0,0,0,1
sinus rhythm with frequent pvcs with pacs.,5,0.0,1,0,1
sinus rhythm with frequent multifocal pvcs with pac(s) with borderline 1st degree a-v block,5,0.0,1,0,1
lead(s) unsuitable for analysis: i avr avl avf v1 v2 v3 v4 v5 v6,5,0.0,0,1,0
lead(s) unsuitable for analysis: iii avl v3,5,0.0,0,1,0
interpolated pvc(s),5,0.0,1,0,1
multifocal pvcs,5,0.0,1,0,1
septal t wave changes are abnormal for age/sex,5,0.0,1,0,1
inferior and lateral st elevation may be a normal variant for age,5,0.0,0,0,1
lead(s) iii were not used for morphology analysis,5,0.0,0,1,0
sinus arrhythmia with non-sustained ventricular tachycardia.,5,0.0,1,0,0
sinus tachycardia with pvc(s) with 1st degree a-v block,5,0.0,1,0,1
sinus bradycardia with sinus arrhythmia with pvcs with 1st degree a-v block,5,0.0,1,0,1
atrial flutter with rapid ventricular response with frequent pvcs or aberrant ventricular conduction.,5,0.0,1,0,1
probable extensive infarct with acute inferior + lateral changes,5,0.0,1,0,1
probable extensive infarct with acute inferior changes,5,0.0,1,0,1
possible ectopic atrial tachycardia with pvcs with pacs,5,0.0,1,0,1
lateral t wave changes are borderline,5,0.0,1,0,1
anterolateral t wave changes suggest myocardial infarction,5,0.0,1,0,1
atrial flutter with multifocal pvcs,5,0.0,1,0,1
lead(s) unsuitable for analysis: ii v1 v2,5,0.0,0,1,0
atrial flutter with pvcs,5,0.0,1,0,1
sinus tachycardia with interpolated pvc(s),5,0.0,1,0,1
probable atrial fibrillation with fusion complexes,5,0.0,1,0,1
sinus arrhythmia with aberrantly conducted supraventricular complexes with pvc(s).,5,0.0,1,0,1
atrial flutter with rapid ventricular response with 4:1 a-v block,5,0.0,1,0,0
bvh with secondary st-t changes,5,0.0,1,0,1
inferior and anterior t wave changes suggest myocardial infarct,5,0.0,1,0,1
probable sinus tachycardia with pvc(s),5,0.0,1,0,1
left ventricular hypertrophy with st-t changes probably due in part to myocardial ischemia,5,0.0,1,0,1
possible ectopic atrial tachycardia with pvcs.,5,0.0,1,0,1
sinus rhythm with undetermined irregularity,5,0.0,1,0,0
sinus bradycardia with sinus arrhythmia with frequent multifocal pvcs,5,0.0,1,0,1
inferior st-t changes are borderline abnormal for age/sex,5,0.0,1,0,1
lead(s) unsuitable for analysis: avf v6,5,0.0,0,1,0
