diagnosis,count,percentage,global,irrelevant,local
sinus bradycardia with pacs with 1st degree a-v block,60,0.0,1,0,1
probable a-v junctional rhythm,60,0.0,1,0,0
probable old anterior infarct,60,0.0,1,0,0
inferior/lateral t wave changes,60,0.0,0,0,1
probable atrial fibrillation with pvcs,59,0.0,1,0,1
atrial fibrillation with rapid ventricular response with paroxysmal idioventricular rhythm or aberrant ventricular conduction.,59,0.0,1,0,1
sinus arrhythmia with pvc(s) with 1st degree a-v block,59,0.0,1,0,1
"inferior and septal st elevation, consider acute infarct",59,0.0,1,0,1
dual chamber pacemaker.,59,0.0,1,0,1
sinus tachycardia with aberrantly conducted supraventricular complexes.,59,0.0,1,0,1
atrial fibrillation with multifocal pvcs,58,0.0,1,0,1
a-v sequential and ventricular pacing,58,0.0,1,0,1
- 2:1 a-v block,58,0.0,1,0,0
inferior and lateral st elevation - cannot rule out myocardial injury,58,0.0,1,0,1
"anterior st elevation, consider recent infarction",57,0.0,1,0,1
probable old lateral infarct,57,0.0,1,0,0
"possible sequence error: v4,v5 omitted",57,0.0,0,1,0
anteroseptal t wave changes may be due to hypertrophy and/or ischemia,57,0.0,1,0,1
possible ectopic atrial rhythm with frequent pvcs,57,0.0,1,0,1
sinus arrhythmia with multifocal pvcs,57,0.0,1,0,1
atrial flutter/fibrillation,57,0.0,1,0,0
atrial flutter with rapid ventricular response with pvc(s) or aberrant ventricular conduction,57,0.0,1,0,1
"probable anterolateral infarct, acute",57,0.0,1,0,0
extensive q waves,57,0.0,0,0,1
*** pediatric criteria used ***,56,0.0,0,1,0
possible atrial flutter with rapid ventricular response with pvc(s) or aberrant ventricular conduction.,56,0.0,1,0,1
inferior + anterior st-t change are nonspecific,56,0.0,0,0,1
lead(s) unsuitable for analysis: v1 v2,56,0.0,0,1,0
sinus arrhythmia with interpolated pvc(s),56,0.0,1,0,1
possible junctional rhythm.,56,0.0,1,0,0
st elevation + t wave inversion,56,0.0,0,0,1
sinus rhythm with bigeminal pacs with 1st degree a-v block.,56,0.0,1,0,1
lead(s) unsuitable for analysis: v5 v6,55,0.0,0,1,0
available leads normal,55,0.0,0,1,0
"st depression, consider ischemia, lateral lds",55,0.0,1,0,1
sinus bradycardia with sinus arrhythmia with pvc(s).,55,0.0,1,0,1
extensive st changes are nonspecific,55,0.0,0,0,1
"inferolateral infarct, acute",55,0.0,1,0,0
low r waves in anteroseptal leads,55,0.0,0,0,1
abnormal q suggests anterior infarct,55,0.0,1,0,1
- bigeminal pacs,55,0.0,1,0,1
possible atrial flutter with rapid ventricular response with pvcs or aberrant ventricular conduction.,54,0.0,1,0,1
sinus tachycardia with aberrantly conducted supraventricular complexes,54,0.0,1,0,1
deep s wave in anteroseptal lead,54,0.0,0,0,1
inferior st-t changes suggest myocardial infarct,54,0.0,1,0,1
probable atrial fibrillation with rapid ventricular response.,54,0.0,1,0,0
atrial fibrillation with rapid ventricular response with frequent pvcs or aberrant ventricular conduction.,54,0.0,1,0,1
sinus tachycardia with sinus arrhythmia with pvc(s).,54,0.0,1,0,1
possible old inferior infarction,54,0.0,1,0,0
sinus rhythm with pvc(s) with pac(s) with borderline 1st degree a-v block,54,0.0,1,0,1
anteroseptal t wave changes suggest myocardial infarct,54,0.0,1,0,1
sinus arrhythmia with frequent multifocal pvcs,53,0.0,1,0,1
unclassified ecg,53,0.0,0,1,0
"lateral st elevation, consider recent infarction",53,0.0,1,0,1
sinus tachycardia with 1st degree a-v block,53,0.0,1,0,0
"extensive st elevation, consider pericarditis",53,0.0,1,0,1
anteroseptal st changes may be due to myocardial ischemia,52,0.0,1,0,1
anterolateral st-t changes are borderline abnormal,52,0.0,1,0,1
r'>r in v1/v2,52,0.0,0,0,1
possible ectopic atrial rhythm with pvc(s) with pac(s),52,0.0,1,0,1
sinus tachycardia with multifocal pvcs,52,0.0,1,0,1
probable acute inferior infarct,51,0.0,1,0,0
borderline abnormal for age and gender,51,0.0,1,0,0
sinus rhythm with bigeminal pvcs with 1st degree a-v block.,51,0.0,1,0,1
consider rvh w/ secondary repol abnormality,51,0.0,1,0,1
- multiform pvcs,51,0.0,1,0,1
lead(s) unsuitable for analysis: v4 v5 v6,51,0.0,0,1,0
"st depression, consider ischemia, diffuse lds",51,0.0,1,0,1
with fusion complexes,50,0.0,1,0,1
- frequent premature ventricular contractions or aberrant ventricular conduction,50,0.0,1,0,1
-------------------- pediatric ecg interpretation --------------------,50,0.0,0,1,0
septal t wave changes are normal for age,50,0.0,0,0,1
sinus tachycardia with sinus arrhythmia with borderline 1st degree a-v block,50,0.0,1,0,0
atrial flutter with pvc(s) or aberrant ventricular conduction,50,0.0,1,0,1
anterior t wave changes are borderline abnormal for age/sex,49,0.0,1,0,1
low maximum qrs spatial velocity,49,0.0,0,0,1
anteroseptal st-t changes may be due to hypertrophy and/or ischemia,49,0.0,1,0,1
delayed intrinsicoid deflection,49,0.0,0,0,1
"marked st depression in v lead, consider recent infarction",49,0.0,1,0,1
probable atrial fibrillation with frequent multifocal pvcs or aberrant ventricular conduction,49,0.0,1,0,1
broad qrs in (v1 or v2) and (v5 or v6),49,0.0,0,0,1
ant/septal and lateral t wave changes are probably due to ventricular hypertrophy,49,0.0,1,0,1
possible ectopic atrial rhythm with pvcs.,49,0.0,1,0,1
probable old inferior infarction,49,0.0,1,0,0
inferior t wave changes,49,0.0,0,0,1
lead(s) unsuitable for analysis: ii,48,0.0,0,1,0
lateral st changes offer additional evidence of ischemia,48,0.0,1,0,1
"probable anterolateral infarct, age indeterm",48,0.0,1,0,0
--- no further analysis due to lack of dominant qrs ---,48,0.0,0,1,0
septal st-t changes are probably due to ventricular hypertrophy,48,0.0,1,0,1
consider anterolateral infarct,48,0.0,1,0,0
probable old septal infarction,48,0.0,1,0,0
acute inferior infarct,48,0.0,1,0,0
probable rvh w/ secondary repol abnormality,48,0.0,1,0,1
complete av block with wide qrs complex,48,0.0,1,0,1
probable atrial fibrillation with rapid ventricular response with pvc(s) or aberrant ventricular conduction.,48,0.0,1,0,1
"inferior infarct, recent",47,0.0,1,0,0
"prominent p waves, nondiagnostic",47,0.0,1,0,1
probable atrial fibrillation with rapid ventricular response with pvcs.,47,0.0,1,0,1
"if rhythm is confirmed, the following report may not be valid",47,0.0,0,1,0
sinus rhythm with occasional pacs.,47,0.0,1,0,1
atrial flutter with slow ventricular response.,47,0.0,1,0,0
"lateral infarct, old",47,0.0,1,0,0
lead(s) unsuitable for analysis: i ii avr,47,0.0,0,1,0
demand pacing; interpretation is based on unpaced beats.,47,0.0,0,1,0
atrial-sensed ventricular-paced complexes,47,0.0,1,0,1
septal t wave changes are probably due to ventricular hypertrophy,47,0.0,1,0,1
"repol abnrm suggests ischemia, inferior leads",46,0.0,1,0,1
extensive intraventricular conduction defect,46,0.0,1,0,1
additional evidence of myocardial ischemia,46,0.0,1,0,0
or aberrant ventricular conduction,46,0.0,1,0,1
- frequent multifocal pvcs,46,0.0,1,0,1
inferior and anterior st-t changes are borderline abnormal,46,0.0,1,0,1
sinus tachycardia with sinus arrhythmia with pvcs.,45,0.0,1,0,1
possible biventricular hypertrophy,45,0.0,1,0,0
atrial fibrillation with slow ventricular response with pvcs or aberrant ventricular conduction,45,0.0,1,0,1
sinus tachycardia with pac(s) with borderline 1st degree a-v block.,45,0.0,1,0,1
probable atrial fibrillation with rapid ventricular response with pvc(s).,45,0.0,1,0,1
probable atrial fibrillation with rapid ventricular response with pvcs or aberrant ventricular conduction.,44,0.0,1,0,1
lateral st elevation - probable lateral extension of infarct,44,0.0,1,0,1
possible lateral infarction - age undetermined,44,0.0,1,0,0
"inferoposterior infarct, acute",44,0.0,1,0,0
sinus rhythm with bigeminal pacs with borderline 1st degree a-v block,44,0.0,1,0,1
atrial fibrillation with fusion complexes,44,0.0,1,0,1
sinus rhythm with multifocal pvcs with pac(s),44,0.0,1,0,1
possible old anterior infarction,44,0.0,1,0,0
*** limb leads reversed. the report below takes this into account ***,43,0.0,0,1,0
probable anterior infarct - age undetermined,43,0.0,1,0,0
atrial fibrillation with frequent pvcs,43,0.0,1,0,1
sinus rhythm with multifocal pvcs with 1st degree a-v block,43,0.0,1,0,1
short qtc interval,43,0.0,0,0,1
inferior/lateral t wave changes may be normal for age,43,0.0,0,0,1
"inferoposterior infarct, recent",42,0.0,1,0,0
ventricular couplet(s),42,0.0,1,0,1
ectopic atrial tachycardia,42,0.0,1,0,0
sinus arrhythmia with frequent pvcs.,42,0.0,1,0,1
av sequential pacing,42,0.0,1,0,1
inferior and anterior st-t changes may be due to hypertrophy and/or ischemia,42,0.0,1,0,1
consider anterior myocardial infarction,42,0.0,1,0,0
atrial fibrillation with intermittent conduction defect.,42,0.0,1,0,0
septal st changes may be due to myocardial ischemia,42,0.0,1,0,1
irregular ectopic atrial bradycardia.,42,0.0,1,0,1
sinus rhythm with bigeminal pvcs with borderline 1st degree a-v block,41,0.0,1,0,1
anterolateral t wave changes are abnormal,41,0.0,0,0,1
possible ectopic atrial bradycardia with pvc(s),41,0.0,1,0,1
sinus bradycardia with sinus arrhythmia with pac(s),41,0.0,1,0,1
missing lead(s): v6,41,0.0,0,1,0
sinus rhythm with intermittent conduction defect,41,0.0,1,0,0
lead(s) unsuitable for analysis: v2 v3,41,0.0,0,1,0
probable atrial fibrillation with frequent pvcs or aberrant ventricular conduction.,40,0.0,1,0,1
deep s wave in lateral leads,40,0.0,0,0,1
inferior/lateral t wave changes are borderline abnormal,40,0.0,1,0,1
atrial fibrillation with slow ventricular response with pvcs or aberrant ventricular conduction.,40,0.0,1,0,1
atrial fibrillation with frequent multifocal pvcs,40,0.0,1,0,1
*** technically unsatisfactory tracing ***,40,0.0,0,1,0
inferior and lateral st elevation - repeat if myocardial injury is suspected,40,0.0,0,0,1
sinus rhythm with aberrantly conducted supraventricular complexes with borderline 1st degree a-v block,40,0.0,1,0,1
sinus bradycardia with pacs with borderline 1st degree a-v block,40,0.0,1,0,1
anterior t wave changes suggest myocardial injury/ischemia,39,0.0,1,0,1
"second deg avb, mobitz i (wenckebach)",39,0.0,1,0,0
markedly posterior qrs axis,39,0.0,1,0,0
atrial fibrillation with paroxysmal idioventricular rhythm.,39,0.0,1,0,0
possible ectopic atrial bradycardia with pac(s).,38,0.0,1,0,1
atrial fibrillation with multifocal pvcs.,38,0.0,1,0,1
sinus rhythm with interpolated pvcs.,38,0.0,1,0,1
possible biatrial abnormality,38,0.0,1,0,0
possible atrial flutter with rapid ventricular response with pvc(s),38,0.0,1,0,1
consider anteroseptal infarct,38,0.0,1,0,0
possible acute lateral infarct,38,0.0,1,0,0
possible recent anterior infarct,37,0.0,1,0,0
lead(s) unsuitable for analysis: v4 v5,37,0.0,0,1,0
sinus bradycardia with aberrantly conducted supraventricular complexes.,37,0.0,1,0,1
sinus bradycardia with pvc(s) with 1st degree a-v block.,37,0.0,1,0,1
anteroseptal t wave changes are abnormal,37,0.0,1,0,1
- frequent multiform pvcs,37,0.0,1,0,1
atrial fibrillation with rapid ventricular response with multifocal pvcs,37,0.0,1,0,1
atrial flutter with high degree a-v block,36,0.0,1,0,0
"tall t, consider metabolic/ischemic abnrm",36,0.0,1,0,1
fast sinus arrhythmia,36,0.0,1,0,0
lateral infarction - age undetermined,36,0.0,1,0,0
anteroseptal t wave changes are probably due to ventricular hypertrophy,36,0.0,1,0,1
anteroseptal st-t changes suggest myocardial infarct,36,0.0,1,0,1
rvh with secondary repolarization abnrm,36,0.0,1,0,1
"s1,s2,s3 pattern",36,0.0,0,0,1
sinus bradycardia with frequent pvcs.,35,0.0,1,0,1
possible atrial flutter with pvcs or aberrant ventricular conduction.,35,0.0,1,0,1
sinus bradycardia with interpolated pvcs,35,0.0,1,0,1
probable atrial fibrillation with uncontrolled ventricular response,35,0.0,1,0,0
tall t waves - consider hyperkalemia,35,0.0,1,0,1
(9@128) suggests early repolarization,35,0.0,1,0,1
lead(s) unsuitable for analysis: iii,35,0.0,0,1,0
sinus arrhythmia with aberrantly conducted supraventricular complexes.,35,0.0,1,0,1
"repol abnrm, global ischemia, diffuse leads",35,0.0,1,0,1
q equivalent in inferior leads,35,0.0,0,0,1
bradycardia with irregular rate,35,0.0,1,0,0
inferior t wave changes may be a normal variant for a female of this age,35,0.0,0,0,1
"abnormal t, probable ischemia, anterior leads",35,0.0,1,0,1
irregular ectopic atrial tachycardia,35,0.0,1,0,1
"abnormal t, probable ischemia, lateral leads",35,0.0,1,0,1
sinus rhythm with 2nd degree (mobitz ii) sa block,35,0.0,1,0,0
probable atrial fibrillation with rapid ventricular response with pvcs or aberrant ventricular conduction,35,0.0,1,0,1
"inferior st elevation, consider recent infarction",35,0.0,1,0,1
possible atrial flutter with pvcs or aberrant ventricular conduction,35,0.0,1,0,1
consider acute lateral infarction,34,0.0,1,0,0
septal st changes may be due to hypertrophy and/or ischemia,34,0.0,1,0,1
sinus bradycardia with interpolated pvc(s).,34,0.0,1,0,1
anterior t wave changes may be due to hypertrophy and/or ischemia,34,0.0,1,0,1
septal st changes suggest myocardial injury/ischemia,34,0.0,1,0,1
sinus rhythm with 2:1 a-v block,34,0.0,1,0,0
possible atrial flutter with pvcs,34,0.0,1,0,1
sinus rhythm with frequent pvcs with pac(s),34,0.0,1,0,1
atrial flutter with uncontrolled ventricular response,34,0.0,1,0,0
possible ectopic atrial rhythm with bigeminal pvcs,34,0.0,1,0,1
anteroseptal st elevation - repeat if myocardial injury is suspected,34,0.0,1,0,1
st changes in the septal lead,34,0.0,0,0,1
- demand a-v sequential and ventricular pacing,34,0.0,1,0,1
"anteroseptal infarct, acute",34,0.0,1,0,0
atrial flutter with rapid ventricular response with pvc(s) or aberrant ventricular conduction.,34,0.0,1,0,1
sinus rhythm with multifocal pvcs with borderline 1st degree a-v block,34,0.0,1,0,1
- paroxysmal idioventricular rhythm,33,0.0,1,0,0
atrial fibrillation with uncontrolled ventricular response with pvc(s).,33,0.0,1,0,1
atrial fibrillation with rapid ventricular response with multifocal pvcs.,33,0.0,1,0,1
probable atrial fibrillation with uncontrolled ventricular response.,33,0.0,1,0,0
"poor quality data, interpretation may be affected",33,0.0,0,1,0
sinus rhythm with aberrantly conducted supraventricular complexes with 1st degree a-v block,33,0.0,1,0,1
possible atrial flutter with pvc(s).,33,0.0,1,0,1
sinus bradycardia with pacs with 1st degree a-v block.,33,0.0,1,0,1
lead(s) unsuitable for analysis: i avl,33,0.0,0,1,0
predominant 2:1 av block,33,0.0,1,0,0
sinus tachycardia with multifocal pvcs.,33,0.0,1,0,1
partial missing lead(s): v4,33,0.0,0,1,0
"nonspecific repol abnormality, inferior leads",33,0.0,0,0,1
anterolateral st elevation - cannot rule out myocardial injury,33,0.0,1,0,1
inferior and anterior t wave changes are abnormal,33,0.0,0,0,1
inferior st-t changes are borderline abnormal,33,0.0,1,0,1
possible extensive infarct with acute anterolateral changes,33,0.0,1,0,1
sinus bradycardia with sinus arrhythmia with interpolated pvc(s),33,0.0,1,0,1
atrial fibrillation with rapid ventricular response with paroxysmal idioventricular rhythm or aberrant ventricular conduction,33,0.0,1,0,1
"abnormal t, probable ischemia, widespread",33,0.0,1,0,1
ant/septal + lateral t wave changes,33,0.0,0,0,1
atrial flutter with 2:1 av block,32,0.0,1,0,0
sinus rhythm with frequent multifocal pvcs with borderline 1st degree a-v block,32,0.0,1,0,1
inferior and ant/septal st-t changes are probably due to ventricular hypertrophy,32,0.0,1,0,1
--- dextrocardia ---,32,0.0,1,0,0
sinus bradycardia with pvc(s) with pac(s).,32,0.0,1,0,1
lead(s) unsuitable for analysis: iii avl,32,0.0,0,1,0
possible early repolarization,32,0.0,1,0,0
septal+lateral st-t changes may be due to myocardial ischemia,32,0.0,1,0,1
probable atrial fibrillation with frequent multifocal pvcs or aberrant ventricular conduction.,32,0.0,1,0,1
extensive st-t changes suggest myocardial infarction,32,0.0,1,0,1
possible atrial flutter with rapid ventricular response with pvc(s).,32,0.0,1,0,1
sinus arrhythmia with pvc(s) with borderline 1st degree a-v block.,32,0.0,1,0,1
atrial fibrillation with uncontrolled ventricular response with pvc(s) or aberrant ventricular conduction,31,0.0,1,0,1
possible atrial flutter with pvcs.,31,0.0,1,0,1
sinus rhythm with frequent multifocal pvcs with 1st degree a-v block,31,0.0,1,0,1
sinus rhythm with frequent pvcs with 1st degree a-v block.,31,0.0,1,0,1
sinus rhythm with frequent pvcs with borderline 1st degree a-v block.,31,0.0,1,0,1
sinus tachycardia with 1st degree a-v block.,31,0.0,1,0,0
a-v dissociation with unclassified aberrant complexes,31,0.0,1,0,1
- non-sustained ventricular tachycardia,31,0.0,1,0,0
irregular ectopic atrial tachycardia.,30,0.0,1,0,1
inferior/lateral t wave changes are abnormal,30,0.0,1,0,1
"inferolateral infarct, old",30,0.0,1,0,0
sinus tachycardia with pacs with borderline 1st degree a-v block,30,0.0,1,0,1
"anterolateral q wave, probably normal for age",30,0.0,0,0,1
ant/septal+lateral t wave changes may be due to myocardial ischemia,30,0.0,1,0,1
ventricular couplets,30,0.0,1,0,1
rvh with secondary st-t changes,29,0.0,1,0,1
anteroseptal infarct - probably acute,29,0.0,1,0,0
broad p waves,29,0.0,0,0,1
probable atrial fibrillation with rapid ventricular response with frequent multifocal pvcs or aberrant ventricular conduction.,29,0.0,1,0,1
irregular ectopic atrial rhythm with pvc(s),29,0.0,1,0,1
- frequent supraventricular extrasystoles,29,0.0,1,0,1
inferior + anterior t wave change are borderline abnormal for age/sex,29,0.0,1,0,1
consider septal infarct - age undetermined,29,0.0,1,0,0
changes v3-v4 are probably due to left ventricular hypertrophy but consider anterior infarction,29,0.0,1,0,1
ant/septal and lateral t wave changes,29,0.0,0,0,1
inferior and lateral t changes,29,0.0,0,0,1
sinus bradycardia with sinus arrhythmia with pac(s) with 1st degree a-v block,28,0.0,1,0,1
possible atrial flutter with rapid ventricular response with pvcs.,28,0.0,1,0,1
septal + lateral st-t changes,28,0.0,0,0,1
anterolateral st elevation,28,0.0,0,0,1
with slow ventricular response,28,0.0,1,0,0
anterior r decrease + inferior q,28,0.0,0,0,1
atrial-ventricular dual-paced complexes,28,0.0,1,0,1
extensive st-t changes may be due to myocardial infarct or cva,28,0.0,1,0,1
consider acute inferior infarction,28,0.0,1,0,0
sinus tachycardia with pacs with borderline 1st degree a-v block.,28,0.0,1,0,1
"rae, consider biatrial enlargement",28,0.0,1,0,0
probable atrial fibrillation with rapid ventricular response with frequent pvcs or aberrant ventricular conduction,28,0.0,1,0,1
possible lvh with secondary st-t changes,28,0.0,1,0,1
summary: available leads normal,27,0.0,0,1,0
rightward qrs axis,27,0.0,1,0,0
sinus bradycardia with pvcs with 1st degree a-v block,27,0.0,1,0,1
failure to sense and/or capture (?magnet),27,0.0,0,1,0
possible atrial flutter with rapid ventricular response with pvcs or aberrant ventricular conduction,27,0.0,1,0,1
sinus rhythm with aberrantly conducted supraventricular complexes with pvcs,27,0.0,1,0,1
sinus arrhythmia with pvcs with 1st degree a-v block,27,0.0,1,0,1
septal+lateral st-t changes are nonspecific,27,0.0,0,0,1
sinus tachycardia with pvc(s) with borderline 1st degree a-v block,27,0.0,1,0,1
sinus bradycardia - consider sinus rhythm with 2:1 s-a block.,27,0.0,1,0,0
sinus bradycardia with pacs with borderline 1st degree a-v block.,27,0.0,1,0,1
inferior/lateral t changes,27,0.0,0,0,1
sinus bradycardia with sinus arrhythmia with pvc(s) with 1st degree a-v block,27,0.0,1,0,1
sinus rhythm with bigeminal pacs with borderline 1st degree a-v block.,27,0.0,1,0,1
sinus tachycardia with sinus arrhythmia with pvcs,27,0.0,1,0,1
probable old anteroseptal infarction,27,0.0,1,0,0
atrial fibrillation with fusion complexes or aberrant ventricular conduction,26,0.0,1,0,1
atrial flutter with slow ventricular response with high degree a-v block,26,0.0,1,0,0
anteroseptal st elevation - cannot rule out myocardial injury,26,0.0,1,0,1
sinus bradycardia with multifocal pvcs,26,0.0,1,0,1
sinus bradycardia with frequent multifocal pvcs,26,0.0,1,0,1
probable atrial fibrillation with slow ventricular response with complete a-v block,26,0.0,1,0,0
anterior t wave changes are abnormal,26,0.0,1,0,1
probable aberrantly conducted supraventricular extrasystoles,26,0.0,1,0,1
"probable anterolateral infarct, recent",26,0.0,1,0,0
"extensive anterior infarct, acute",26,0.0,1,0,0
anteroseptal st-t changes are probably due to ventricular hypertrophy,26,0.0,1,0,1
anteroseptal t wave changes suggest myocardial injury/ischemia,26,0.0,1,0,1
sinus rhythm with intermittent conduction defect.,26,0.0,1,0,0
faulty v3 - omitted from analysis,26,0.0,0,1,0
lead(s) avl were not used for morphology analysis,26,0.0,0,1,0
consider dextrocardia,26,0.0,1,0,0
rbbb with rad - possible left posterior fascicular block,26,0.0,1,0,1
sinus rhythm with pvc(s) with pac(s) with borderline 1st degree a-v block.,25,0.0,1,0,1
atrial flutter with slow ventricular response with 4:1 a-v block,25,0.0,1,0,0
inferior + anterior st-t change may be due to myocardial ischemia,25,0.0,1,0,1
ant/septal+lateral st-t changes are nonspecific,25,0.0,0,0,1
probable atrial fibrillation with rapid ventricular response with pvcs,25,0.0,1,0,1
atrial-sensed ventricular-paced rhythm,25,0.0,1,0,1
probable atrial fibrillation with multifocal pvcs or aberrant ventricular conduction.,25,0.0,1,0,1
- multiform pvcs or aberrant ventricular conduction,25,0.0,1,0,1
uncertain rhythm: review,25,0.0,1,0,0
consider left ventricular hypertrophy suggested by voltage criteria only,25,0.0,1,0,1
probable atrial fibrillation with rapid ventricular response with multifocal pvcs or aberrant ventricular conduction,25,0.0,1,0,1
inferior and ant/septal t wave changes are abnormal,25,0.0,1,0,1
consider wolff-parkinson-white pattern type b,25,0.0,1,0,1
lead(s) unsuitable for analysis: iii avf,25,0.0,0,1,0
lateral st changes may be due to hypertrophy and/or ischemia,25,0.0,1,0,1
atrial fibrillation with frequent pvcs.,25,0.0,1,0,1
atrial fibrillation with uncontrolled ventricular response with pvc(s),25,0.0,1,0,1
- multifocal pvcs or aberrant ventricular conduction,25,0.0,1,0,1
q in inferior + lateral leads,25,0.0,0,0,1
inferior/lateral st changes are probably due to ventricular hypertrophy,25,0.0,1,0,1
possible ectopic atrial rhythm with bigeminal pacs,25,0.0,1,0,1
possible acute anterolateral infarct,24,0.0,1,0,0
anterior infarction - age undetermined,24,0.0,1,0,0
strongly suggests myocardial infarction,24,0.0,1,0,0
possible old anteroseptal infarction,24,0.0,1,0,0
possible ectopic atrial rhythm with frequent pvcs.,24,0.0,1,0,1
"st depr, consider ischemia, anterior leads",24,0.0,1,0,1
lateral st-t changes may be related to electronic pacemaker,24,0.0,0,0,1
possible ectopic atrial rhythm with bigeminal pvcs.,24,0.0,1,0,1
possible ectopic atrial rhythm with multifocal pvcs,24,0.0,1,0,1
sinus rhythm with pvc(s) with pac(s) with 1st degree a-v block.,24,0.0,1,0,1
partial missing lead(s): v3,24,0.0,0,1,0
atrial flutter with rapid ventricular response with pvc(s),24,0.0,1,0,1
"tall r wave in v2, consider rvh or pmi",24,0.0,1,0,1
sinus bradycardia with pvcs with borderline 1st degree a-v block,24,0.0,1,0,1
probable atrial fibrillation with complete a-v block.,24,0.0,1,0,0
inferior and ant/septal t wave changes may be due to hypertrophy and/or ischemia,24,0.0,1,0,1
wide complex tachycardia,24,0.0,1,0,1
"appearances suggest arm lead reversal - only leads avf, v1 - v6 analysed.",24,0.0,0,1,0
extensive st-t changes may be related to electronic pacemaker,24,0.0,1,0,1
inferior + septal t wave changes are nonspecific,23,0.0,0,0,1
irbbb and lpfb,23,0.0,1,0,1
sinus rhythm with aberrantly conducted supraventricular complexes with pvc(s).,23,0.0,1,0,1
sinus tachycardia with sinus arrhythmia with borderline 1st degree a-v block.,23,0.0,1,0,0
sinus bradycardia with sinus arrhythmia with pvcs,23,0.0,1,0,1
inferior t wave changes may be a normal variant for a male of this age,23,0.0,0,0,1
anterior st-t changes suggest myocardial injury/ischemia,23,0.0,1,0,1
anterolateral st-t changes are abnormal,23,0.0,0,0,1
"lad, consider lafb or inferior infarct",23,0.0,1,0,0
frequent pvcs,23,0.0,1,0,1
with uncontrolled ventricular response,23,0.0,1,0,0
sinus rhythm with 2nd degree (mobitz ii) sa block.,23,0.0,1,0,0
inferior and septal st-t changes may be due to myocardial ischemia,23,0.0,1,0,1
marked ant/septal stj depression is probably reciprocal to inferior infarct,23,0.0,1,0,1
tall r v1/v2 consistent with the infarct,23,0.0,1,0,1
inferior/lateral st-t changes may be related to electronic pacemaker,23,0.0,1,0,1
sinus arrhythmia with pvcs with borderline 1st degree a-v block.,23,0.0,1,0,1
lead(s) unsuitable for analysis: v1 v2 v3,23,0.0,0,1,0
sinus arrhythmia with multifocal pvcs.,23,0.0,1,0,1
atrial flutter with rapid ventricular response with pvc(s).,23,0.0,1,0,1
inferior and ant/septal st-t changes suggest myocardial injury/ischemia,23,0.0,1,0,1
atrial flutter with pvc(s),23,0.0,1,0,1
wandering atrial pacemaker,22,0.0,1,0,0
"extensive anterior infarct, old",22,0.0,1,0,0
inferior t wave changes are borderline abnormal for age/sex,22,0.0,1,0,1
changes are possibly due to right ventricular hypertrophy,22,0.0,1,0,0
anterolateral st changes suggest myocardial injury/ischemia,22,0.0,1,0,1
*** extensive infarct - possibly acute ***,22,0.0,1,0,0
inferior and anterior st-t changes suggest myocardial injury/ischemia,22,0.0,1,0,1
with fusion complexes or aberrant ventricular conduction,22,0.0,1,0,1
atrial fibrillation with rapid ventricular response with frequent pvcs.,22,0.0,1,0,1
non specific changes,22,0.0,1,0,0
inferior and septal st-t changes may be due to hypertrophy and/or ischemia,22,0.0,1,0,1
may be related to the electronic pacemaker activity,22,0.0,1,0,1
sinus arrhythmia with pvc(s) with 1st degree a-v block.,22,0.0,1,0,1
inferior + anterior st-t change,22,0.0,0,0,1
probable inferior infarction - age undetermined,22,0.0,1,0,0
"repol abnrm suggests ischemia, anterior leads",22,0.0,1,0,1
a-flutter/fibrillation w/ complete av block,22,0.0,1,0,0
sinus arrhythmia with pvcs with borderline 1st degree a-v block,22,0.0,1,0,1
